body,title,url"
La guerra en Ucrania podría estar cerca de entrar en una nueva fase, particularmente complicada. No es que las otras no lo hayan sido, pero en la medida en que un conflicto armado se prolonga, y en la medida en que las partes se encuentran dispuestas a seguir y crecer las hostilidades, el resultado natural es una espiral ascendente de violencia que no tiende sino a incrementar los riesgos. Es en ese sentido—tanto en términos de la prolongación del conflicto, como en la escalada—que el debate acerca del mayor y mejor armamento que será suministrado a Ucrania por parte de sus aliados occidentales, cobra un mayor peso. En el texto de hoy revisamos la fase actual y la fase que sigue en esa guerra, además del tema del armamento y el potencial real que ese armamento tiene para impactar en el panorama que estamos viendo. 1. Fases previas y fase actual del conflicto. Como explicamos hace algunas semanas, nos encontramos en una cuarta fase de la guerra. La primera fue la ofensiva relámpago rusa sobre tres fronteras del territorio buscando tomar velozmente el control de la infraestructura militar y política del país. Ello fracasó y dio pie a una segunda fase: el repliegue ruso de la zona de Kiev y su concentración en el este y el sur con algunas ofensivas relativamente exitosas para Moscú. La tercera fue una fase de contraofensivas ucranianas mediante las que recuperó una parte del territorio que Rusia había conquistado, concretamente en el noreste y en la provincia de Kherson. En esta cuarta fase, Rusia ha reposicionado sus líneas de defensa hacia atrás, enviando a decenas de miles de tropas recientemente reclutadas para la defensa de esas líneas, cavando trincheras, construyendo barricadas y apostando por el desgaste invernal que dificulta cualquier operación. Paralelamente, Rusia se mantiene bombardeando la infraestructura civil y energética de Ucrania. 2. Los resultados de la fase 4. Lo que Moscú buscaba en esta fase era, primero, estabilizar el conflicto, frenar la dinámica de la etapa previa en la que estaba perdiendo territorio (Rusia había perdido ya más de la mitad del territorio que capturó desde que inició la guerra), y de ser posible obtener nuevas victorias, aunque pequeñas, enormemente simbólicas; segundo, Rusia pretendía desgastar la moral ucraniana, golpear psicológicamente a su sociedad y provocar fracturas políticas tanto en ese país como entre sus aliados. En el primer objetivo, Rusia ha marcado algunos puntos. No solo las líneas se estabilizaron, sino que estamos viendo incluso algunas victorias rusas en el este. En el segundo objetivo, es difícil afirmar que la estrategia de Moscú haya sido exitosa. La determinación ucraniana y su disposición a continuar la lucha—a pesar de los continuos bombardeos y las afectaciones a su población civil—se sigue viendo muy fuerte. Paralelamente, si bien se asoman algunas fisuras en Occidente, éstas son menores; la alianza se mantiene sólida. Esto puede cambiar, pero no es lo que ha sucedido hasta ahora. 3. La fase que viene: la quinta. Conforme el invierno vaya cediendo, es probable que nuevas ofensivas por parte de ambos ejércitos se empiecen a dibujar. Para ello, Rusia ha reabastecido las zonas de combate con cientos de miles de soldados apenas reclutados y entrenados, que han sido reforzados por decenas de miles de mercenarios del grupo privado Wagner, muy cercano a Putin. A este grupo privado se atribuyen algunas de las recientes victorias rusas. Paralelamente, Rusia está amasando tropas y efectuando ejercicios militares conjuntos con Bielorrusia, activando nuevamente el frente norte, ya sea porque realmente planea un nuevo asalto sobre Kiev, o porque pretende distraer la atención ucraniana con el fin de seguir empujando lentamente por el este. Ucrania se prepara no solo para defenderse de esas potenciales ofensivas, sino para nuevamente, aprovechar las muchas vulnerabilidades que ha exhibido el ejército ruso y buscar recapturar más territorio invadido como lo consiguió en el otoño. Esto presagia una fase llena de choques, plagada de rondas de artillería pesada, probablemente con avances y retrocesos para ambos ejércitos y posiblemente incluso más sangrienta que las fases previas. Este es el punto en el que el debate acerca del armamento cobra relevancia. 4. El debate del armamento: la dimensión política. Ucrania siempre va a buscar, naturalmente, más y mejor armamento para poder sostener esta guerra. Pero tanto entre los aliados de la OTAN, como al interior de las sociedades de esos países, ha habido una enorme discusión al respecto. Hay sociedades como la alemana, fuertemente marcadas por su histórico rol en conflictos como la primera o segunda guerra mundial, que en la actualidad no quisieran ser percibidas como actores beligerantes, sino más bien, preferirían ser vistas como actores que están del lado de la resolución del conflicto. Otros, como sucede en Estados Unidos, temen que un incremento en la calidad y capacidad de las armas para Ucrania pudiera provocar escaladas imprevistas y ocasionar que la situación se salga de control aún más de lo actual. También en ese y otros países ha habido actores a quienes preocupan los altos niveles de corrupción en Ucrania y temen malos manejos de donaciones o equipos pagados con impuestos de su ciudadanía. En cambio, otros países como Reino Unido o algunos de Europa Central, argumentan que este es justo el punto en el que Ucrania debe ser más apoyada para sacar ventaja de los errores estratégicos y tácticos de Rusia, y que ello urge para derrotar clara y decisivamente a Moscú. De modo que detrás de las decisiones de suministrar armas a Ucrania, no solo hay consideraciones militares, sino también, posiciones políticas y mensajes, hacia dentro de los propios países y hacia afuera. 5. El debate del armamento: la dimensión material real. Lo anterior nos lleva a evaluar, por ejemplo, el asunto de los tanques. Finalmente, EU y Alemania han accedido a proveer los tanques más avanzados al ejército ucraniano, los cuales se suman a los británicos anunciados hace dos semanas. Pero en realidad es difícil que el impacto de esos tanques se pueda apreciar de manera inmediata dentro de la fase que estamos previendo inicie en pocas semanas. Además de que son pocos (Kiev pedía cientos, le llegarán algunas decenas), está la dificultad logística de transportar esos tanques—¿cómo exactamente serán transportados? ¿cómo y cuándo llegarán al frente?—se trata de equipos muy complejos que necesitan mucho tiempo de entrenamiento para poderlos emplear de manera eficaz en combate. Todo eso tomará, cuando menos, varios meses. Esto significa al menos dos cosas. La primera es que los gobiernos occidentales están previendo que el conflicto, en efecto, se va a prolongar por mucho tiempo más (el jefe del Estado Mayor Conjunto de EU, indicó que ve muy difícil que Ucrania pueda sacar a Rusia de su territorio en 2023); la segunda es que se está buscando, sobre todo, enviar un mensaje a Rusia al respecto de la unidad de Occidente y su determinación para seguir rompiendo sus propios límites con tal de apoyar a Ucrania hasta el final. Hay quienes piensan, sin embargo, que esas decisiones y mensajes llegan demasiado tarde pues la fase 5 está a la vuelta de la esquina. Aún así, hay otro tipo de armamento como las bombas de diámetro pequeño que Washington está enviando a Ucrania, que podrían ser mucho más determinantes en el corto plazo, pues duplicarán el alcance de los sistemas de lanzamiento de cohetes múltiples con los que cuenta Kiev (como los HIMARS). Y estos últimos sí fueron cruciales para los avances ucranianos del otoño. 6. ¿Qué factores determinan la victoria en una guerra como esta? En suma, nos encontramos ante un tipo de guerra larga entre Estados-Nación, la cual ha adoptado características más similares a las guerras del siglo XX que a las guerras del siglo XXI, y que, por tanto, necesita ser evaluada bajo consideraciones más tradicionales. Desempolvando los textos añejos, recordamos que los factores que hacían ganar a los países una guerra de estas características tenían que ver temas como el tamaño de la población (y la capacidad de movilizar a esa población), la logística (y la capacidad de abastecer eficazmente a las líneas de combate estacionadas ahí durante largos períodos), la economía (para sostener largos períodos de desgaste), el armamento (y la tecnología de punta para ese armamento), la geografía, o por supuesto, la moral. En varios de esos aspectos Rusia ha mostrado múltiples y muy serias debilidades, pero en guerras largas, las posibilidades de aprender y cambiar decisiones, comportamientos y tácticas, aumentan. Es por ello que, para Kiev, el apoyo de Occidente en varios de los puntos que señalo, es incluso más crucial hoy que antes. Dicho eso, sí es importante tomar en cuenta que, en la medida en que los distintos actores echan mano y ponen en juego a toda esa serie de componentes, en esa medida, los riesgos de escalamiento siguen aumentando.    Instagram: @mauriciomesch Twitter: @maurimm  Suscríbete aquí para recibir directo en tu correo nuestras newsletters sobre noticias del día, opinión, y muchas opciones más.  ",,http://www.eluniversal.com.mx/opinion/mauricio-meschoulam/ucrania-la-fase-que-viene-el-debate-sobre-tanques-y-armamento
"
 Desde la firma del TLC, México inició una progresiva integración con los Estados Unidos, una que fue más allá de lo meramente económico, ya que favoreció la adopción de usos culturales y modas políticas.  La apertura comercial coincidió con la consolidación de la transición democrática de México, y nuestros partidos políticos fueron tropicalizando los aspectos más frívolos de la neurosis norteamericana presente en las contiendas electorales: la imagen personal perfecta, los lemas políticos probados en infinitos grupos de enfoque, y el diseño de la estrategia de campaña a manos de expertos del marketing aplicado a temas electorales. Hasta que llegó el 2018.  Hace más de cuatro años, un 1 de julio, la furia y catarsis de quienes sentían que el país había dejado de tomarlos en cuenta y era conducido en divorcio con la realidad, optó, sin mucha consideración, por Morena y su candidato. Triunfó la campaña más primitiva en términos de diseño de imagen y, probablemente, en el uso de herramientas modernas de estrategia electoral. El partido guinda se benefició inercialmente de un sentimiento social que ya estaba ahí; si acaso, lo único innovador de su desempeño fue el uso de granjas de bots en las redes sociales —arma digital que siguen utilizando hoy en día—.  A partir de entonces, Morena apostó por repetir ad nauseam un estilo que le es muy favorable: la campaña aparentemente más rudimentaria es la “auténtica” y la campaña sofisticada y bien producida es “más de lo mismo”.  Como alguien convencido de la necesidad de ciudadanizar la política, no puedo dejar de señalar que hoy Morena se beneficia de un estilo muy peculiar de hacer y dar imagen a sus campañas. La campaña “mal hecha” en sus eslóganes, producción y discurso —casi perezosa e infantil—, es la que se identifica con el pueblo. Mientras que las campañas mejor estructuradas y producidas, desde el punto de vista del marketing tradicional, suenan falsas, frívolas y recuerdan todo lo que las mayorías han rechazado. Morena ha impuesto una pegajosa moda primitiva para las campañas y pareciera que quienes militamos en partidos distintos nos resistimos a aceptar esa realidad.  No podemos ignorar que el 2018 representó un ajuste telúrico. No solo en el rumbo de la democracia mexicana, sino que también implicó un profundo cambio en las percepciones ciudadanas sobre cómo debe ser una campaña que convenza a los electores. No hagamos como si el 2018 no hubiera ocurrido y mantengamos las mismas tomas de cámara, las sonrisas perfectas, la misma musicalización y las “genialidades” que hoy probablemente siguen incitando el desencanto de millones.  Las campañas de Va por México tendrán que desarrollar fórmulas frescas para su presentación a la ciudadanía. Requerimos un estilo de comunicación que los ciudadanos puedan ver como la síntesis de lecciones aprendidas, pero también como un nuevo capítulo nacional que los puede beneficiar de formas concretas.  Las campañas no ocurren en el vacío. Al igual que la música, la pintura y el arte en general, evolucionan a la par de la sociedad. En México estamos ante un punto de inflexión, y concebir a la política como un arte requiere ponerse al día. Estamos viviendo un mundo nuevo, no pretendamos convocar la imaginación y el entusiasmo con estéticas ya sepultadas por la historia y el humor social vigentes.  Como ha quedado claro, lo más peligroso para una democracia mexicana bajo el asedio morenista, es una oposición poco imaginativa y autocomplaciente. Son tiempos de audacia.    Secretario de Acción Electoral del CEN del PRI  Suscríbete aquí para recibir directo en tu correo nuestras newsletters sobre noticias del día, opinión, y muchas opciones más.  ",,http://www.eluniversal.com.mx/opinion/rolando-zapata-bello/campanas-en-un-nuevo-mundo
"

A unos meses de que entre en operaciones Mexicana de Aviación, la nueva aerolínea del gobierno federal, la Secretaría de la Defensa Nacional (Sedena) enviará a sus pilotos y especialistas de la Fuerza Aérea Mexicana (FAM) a cursos de capacitación para todo tipo de aviones, incluidos el Boeing 787-8, modelo del avión presidencial TP-01.

En el estudio de mercado PC-007000999-E1050-2022, del cual EL UNIVERSAL tiene copia, se detalla que el Ejército licitará cursos de capacitación para 272 pilotos aviadores y especialistas de la FAM.

“La Secretaría de la Defensa Nacional (Fuerza Aérea Mexicana) como dependencia del gobierno federal, requiere para sus actividades de suministro, arrendamiento y/o prestación de servicios, mismas que se encuentran reguladas por la Ley de Adquisiciones, Arrendamientos y Servicios del Sector Público y su Reglamento para obtener información para contratar bajo las mejores condiciones disponibles para el Estado”, se lee.
 Leer también: Diputados de Acción Nacional definen agenda legislativa

“Con el objeto de conocer la existencia de bienes, arrendamientos o servicios a requerir en las condiciones que se indican; posibles proveedores a nivel nacional o internacional; el precio estimado de lo requerido, y la capacidad de cumplimiento de los requisitos de participación, nos permitimos solicitar su valioso apoyo a efecto de proporcionarnos la información/cotización del proyecto ‘Cursos de capacitación para el personal de pilotos aviadores y especialistas de la FAM’”.

Se detalla que la fecha para presentar la cotización fue el pasado 15 de enero.

Vencido el plazo, la Fuerza Aérea Mexicana definirá el procedimiento a seguir para la contratación, el cual podrá ser licitación pública, invitación a cuando menos tres personas y/o adjudicación directa, mismo que se informará a las personas que presentaron su cotización.

“Asimismo, con fundamento en la Ley de Adquisiciones, Arrendamientos y Servicios del Sector Público, el proyecto se materializará mediante procedimientos licitatorios a través de medios electrónicos, por lo que los participantes deberán estar inscritos en CompraNet”.

En noviembre pasado, el presidente Andrés Manuel López Obrador informó que el TP-01 se integraría a la flota de la nueva aerolínea para viajes especiales, y el 5 de diciembre anunció que la línea aérea estará lista a finales de este año.

“La nueva línea va a estar en un año, ese es el plan, a finales del año próximo [2023] va a estar junto a la entrada en funcionamiento del tren y se está haciendo el avalúo sobre la marca de Mexicana para presentar a los trabajadores de Mexicana, los activos y jubilados”, señaló en esa ocasión.

El 6 de enero de 2023, el gobierno federal acordó con los sindicatos que representan a los extrabajadores la compra de la marca Mexicana y otros activos por 815 millones de pesos.

Especificaciones

En la ficha técnica del estudio se detalla que para el Boeing 787-8 se dará un curso inicial para especialistas en electrónica de avión para cuatro pilotos, además de otra capacitación recurrente para esta aeronave a cuatro pilotos y especialistas.

Relativo al mismo modelo del avión TP-01, también se dará el Curso inicial de Operaciones en el Pacífico Norte, NOPAC, Curso de Jeppesen, Operaciones RVSM y Curso ETOPS General (EMB-145, B-737, B-787, B-G-550), el cual será impartido en dos escalones de 10 pilotos aviadores y un escalón de nueve pilotos aviadores, cubriendo un mínimo de 16 horas de teoría.

El taller deberá ser impartido en idioma inglés-español.

“La duración del curso será de conformidad con el programa del proveedor una vez se proporcione el calendario de fechas disponibles a esta secretaría y se determine la fecha más adecuada para la materialización del mismo del 1 de enero al 31 de diciembre del año 2023”.

También se darán cursos iniciales y de instrucción para aviones Cessna 27J, Cessna 130, EMB-145, Gulfstream G550, King Air 350, entre otros.

El pasado 6 de enero, el gobierno federal dio a conocer la compra de la marca Mexicana y otros activos.

En total, la administración federal, a través de la Secretaría de Infraestructura, Comunicaciones y Transportes (SICT) adquirió la marca Mexicana de Aviación, que incluye otras submarcas, un edificio en Guadalajara, un piso en la calle de Balderas en la Ciudad de México, el centro de adiestramiento que está frente al Aeropuerto Internacional de la Ciudad de México (AICM), y un simulador de vuelo. El gobierno desembolsó 815 millones de pesos por estos activos.



Acuerda PAN cerrar filas y frenar la reforma electoral 
 





Suscríbete aquí para recibir directo en tu correo nuestras newsletters sobre noticias del día, opinión, y muchas opciones más.
",Buscan capacitar a pilotos para la aerolínea militar,http://www.eluniversal.com.mx/nacion/sedena-mandara-capacitar-pilotos-para-nueva-aerolinea
"
 Con la hospitalidad de EL UNIVERSAL mencionaré algunas preocupaciones que comparten muchos compatriotas. Las expondré muy brevemente, en un par de artículos. Lo hago con respeto y afecto para los impartidores de justicia que honran su desempeño. Son muchos y se mantienen en pie, pese a todo.  Hablo de desafíos. No son escasos ni menores los que afrontan los jueces de la República. Adquieren mayor dimensión en horas difíciles, si consideramos que la Suprema Corte de Justicia (y todo el aparato jurisdiccional) es el gran contrapeso de las pretensiones autoritarias que prevalecen en otras instancias del poder. Una de éstas ha proclamado su menosprecio por la ley; la otra se alinea con docilidad. Por ello, la nación pone su mirada en la justicia.  1. El mayor desafío para los tribunales es mantener la confianza del pueblo en el Estado de Derecho. Implica asegurar legitimidad, legalidad y racionalidad, en grave riesgo. También, combate a la corrupción. Sobran ejemplos sobre el acoso impuesto a la justicia. Se injuria a sus titulares y se menoscaba su autoridad. Muchos jueces resisten con entereza. Les aguarda un largo y difícil camino, colmado de obstáculos.  2. La justicia requiere juzgadores leales a su misión (y sólo a ella), que resistan las seducciones del poder o la riqueza. Un jurista insigne aseguró: “Los jueces son como los que pertenecen a una orden religiosa. Cada uno de ellos tiene que ser un ejemplo de virtud, si no quiere que los creyentes pierdan la fe”; y agregó: “Tan elevada es en nuestra estimación la misión del juez y tan necesaria la confianza en él, que las debilidades humanas que no se notan o se perdonan en cualquier otro orden de funcionarios públicos, parecen inconcebibles en un magistrado”. Así es.  3. Hace dos siglos, los juzgadores fueron “boca que pronuncia las palabras de la ley”. Ya no es así. Hoy los tribunales —ante todo, el Tribunal Constitucional— contribuyen a la formación del orden jurídico. Concurren a definir el rumbo de la República. Su cimiento se halla en los valores y principios del Estado constitucional. Por eso los adversarios de la justicia pretenden, con fiereza, condicionar el desempeño de los tribunales.  4. Rige el principio de separación de poderes, garantía del Estado de Derecho. Pero hay sectores del poder público —peor aún, personajes de éste— que militan por la subordinación de todos los poderes a uno solo: el poder omnímodo, “aspiracionista”, es decir, con “aspiraciones” dictatoriales. La magistratura resiste. Mantiene a salvo su responsabilidad. Este es un enorme desafío.  5. En el auténtico juez concurren virtudes eminentes: probidad sin fisura, independencia e imparcialidad. Quien no las acredita, a costa de lo que sea, no merece portar la toga. El juez obedece a la ley, pero nunca —jamás— a quien pretende sustituirla por una voluntad imperial. Gran desafío de nuestro tiempo y nuestro medio.  6. El buen juez enfrenta la rudeza del poder, desbordante. Frente a éste debe tutelar los derechos humanos. Es obligación del Estado preservar los derechos fundamentales de todos: no sólo de los amigos o partidarios de una facción, con agravio o injuria para los otros. La Constitución dispone: todas las autoridades están obligadas a respetar y garantizar los derechos humanos. En efecto, lo están, comenzando por la autoridad más elevada, que es la más obligada y también la más omisa. Pero este deber tiene acento especial cuando se trata del juzgador. Confiamos en él más que en otras autoridades para salvar nuestros derechos y libertades. He aquí un enorme desafío.    Profesor emérito de la UNAM      Suscríbete aquí para recibir directo en tu correo nuestras newsletters sobre noticias del día, opinión, y muchas opciones más.   ",,http://www.eluniversal.com.mx/opinion/sergio-garcia-ramirez/los-desafios-que-afrontan-nuestros-tribunales-i
