body,title,url"
Usted, lectora-lector, puede creerle a quien quiera en el juicio de Genaro García Luna, que se lleva a cabo en una corte de Brooklyn, Nueva York, y que es un caso muy relevante, porque lo que está en el banquillo es la viabilidad de la guerra contra las drogas de Estados Unidos y México, sus nulos resultados, su escasa utilidad luego de 51 años de sangre que han costado cientos de miles (¿o millones?) de muertos a causa de las balas y de los estupefacientes en ambos lados de la frontera.     Si usted es fan de Vicente Fox, ándele, créale el antiguo supercop, al exdirector de la Agencia Federal de Investigación durante el sexenio foxista, y sostenga que él nunca hizo montajes televisivos para presumir arrestos ni tampoco tuvo relaciones peligrosas con narcotraficantes, plagiarios y extorsionadores.      Si usted es admirador de Felipe Calderón y su guerra, venga, meta las manos al fuego por el exsecretario de Seguridad Pública (2006-2012), ese personaje que hechizó a tantos funcionarios, gobernadores, alcaldes, gente de la sociedad civil, y a no pocos periodistas que a diestra y siniestra dijeron ser amigos de quien -presumían sin pudor- era, según ellos, “el mejor policía de México y, si me apuras, hasta del mundo, mano”.    Si usted es un antiguo mirrey que amará siempre a su lord Enrique Peña Nieto, adelante, defienda al antiguo miembro del Centro de Investigación y Seguridad Nacional (CISEN) y jure usted que el caballero contratista en ese sexenio no fue ni es corrupto, que jamás desvió recursos para enriquecerse, y que ni él ni sus familiares recibieron millonarias transferencias del gobierno mexicano a través de la Secretaría de Gobernación.     Si usted cree en la honestidad, rectitud y aptitudes detectivescas de ese ingeniero que apantalló incluso a académicos y a empresarios que lo hicieron su consultor, está usted en su derecho, defiéndalo en sus redes o en sus tertulias.     Si usted es un expolítico, un exalto funcionario gringo de seguridad o justicia, y recuerda con pasión cuando usted y los suyos no solo presumían a su mexican cop y le entregaban diplomas, reconocimientos y se tomaban fotos con él, sino que le compartían relevante información de seguridad nacional, archivos top secret, y le daban cuantiosos recursos a través de convenios de colaboración con México, good, continúe ensalzándolo, usted sabrá dónde terminaron esos documentos y dineros, y a quién beneficiaron en México y Estados Unidos.      Ahora bien, si usted no le cree nada a Genaro García Luna, y nunca se dejó hipnotizar por él, usted está en su derecho de crucificarlo.     Pero, entonces, ¿quién dice la verdad en el juicio contra el antiguo hijo predilecto de la DEA? ¿El supuestamente impoluto ex sheriff mexicano, acusado de tres cargos por tráfico de cocaína, uno por delincuencia organizada, y otro por dar declaraciones falsas? ¿O el testigo de la Fiscalía, este violento criminal confeso, Sergio Villarreal Barragán, “El Grande”?     No sea prejuicioso con el capo, demos una repasada básica a lo que suele suceder con este tipo de declarantes, que sin duda desde hace muchas décadas tienen sus pros y sus contras en el sistema estadunidense. ¿Qué podemos decir a favor?     1.- Que gracias a gente que estaba dentro de las organizaciones criminales las instituciones de justicia de Estados Unidos pudieron construir casos sólidos contra relevantes capos a partir de los años 30 del siglo pasado y lo siguen haciendo hasta estos días.    2.- Que gracias a esas infidencias de los delincuentes ha sido posible conocer la forma en que operan sus organizaciones no solo en cuanto al tráfico de estupefacientes, sino al trasiego de armas y al lavado de dinero, y gracias a ello se ha conseguido desmantelar parte de sus cárteles. Lo mismo ha ocurrido en México, como hemos visto plasmado a lo largo de los años en los informes de inteligencia del Estado mexicano.     En contra podemos afirmar que muchos de estos testigos son capaces de inventar cualquier cosa e incriminar a quien sea con tal de obtener beneficios para reducir sus penas.     Yo, yo no puedo creerle a ninguno, porque, en primer lugar, los periodistas debemos dudar de todo, especialmente de aquello que proviene del poder (de cualquier poder, ya sea establecido o fáctico), y en segundo lugar porque el periodismo no es un acto de fe sino un oficio que tiene que sustentarse en lo comprobable, lo verificable. De entrada le digo que, en mi experiencia, casi todos los servidores públicos mienten, ocultan información, o la tergiversan, y los criminales suelen ser mitómanos incurables.      Entonces, ¿en quién confiamos, quién podría ser veraz en este caso?   ¿LEVANTÓN Y OCULTAMIENTO, O MITOMANÍA?   Le expongo un solo hecho que por sí solo bastaría para determinar si El Grande habla con la verdad o inventa, y por tanto si todo el juicio contra García Luna será un caso sólido, o se tratará de un show mediático de poca monta (en Estados Unidos no ha llamado la atención) que no servirá más que para alguien teclee el guion de una serie de televisión muy chafita.     Durante el segundo día de su comparecencia ante la Corte del Distrito Este de Nueva York, El Grande afirmó que en octubre del 2008 (sexenio de Calderón) el entonces secretario de Seguridad Pública (García Luna) fue secuestrado en Morelos por órdenes de un capo muy famoso en aquella época, Arturo Beltrán Leyva, El Barbas. El objetivo del levantón habría sido amenazar a García Luna para que siguiera colaborando con su organización criminal, ya que el hombre andaba rejego, a pesar de que presuntamente lo tenían bien maiceado con cientos de miles de dólares (¿o millones?), y parecía, a ojos del narco, que el funcionario ayudaba a Joaquín El Chapo Guzmán e Ismael El Mayo Zambada, sus antiguos socios que luego se convirtieron en rivales.     “Para que veas que puedo llegar hasta ti”, le habría dicho el capo al policía.       Lo que se informó oficialmente en ese entonces fue que algunos escoltas del funcionario sí habían sido levantados por un comando armado que viajaba en ocho camionetas, pero que García Luna no estaba en el lugar de los hechos.     A ver, obviamente que era imposible que el muy macho gobierno de Calderón aceptara que un cártel le había dado un levantón a su policía estrella. Primer tiempo. ¿Cómo iba García Luna explicar a su jefe semejante bochorno? ¿Qué iba a decir? Este, jefe, con la novedad de que… me levantaron en Morelos los Beltrán Leyva, pero fue un error, y me dejaron vivo porque me respetan, y a usted le tienen miedo.      O, bien, para ocultar sus vínculos con el narco: Señor Presidente, estos desgraciados me levantaron porque quisieron negociar con nosotros, pero yo me negué, primero muerto que traicionarlo a usted y a la patria, y evocando su valentía, Señor Presidente, les dije que nosotros no negociamos con criminales, y les advertí que si no me soltaban, les caería encima toda la fuerza del Estado.      Por cierto, en los hechos así fue: poco más de un año después, en diciembre de 2009, la Marina abatió a El Barbas en Cuernavaca, luego de un muy duro enfrentamiento.       Segundo tiempo. ¿Qué decimos, Genaro? Sugiero, señor Presidente, que digamos que secuestraron un rato a unos cuantos de mis escoltas y que ahí quede todo.      Haiga sido como haiga sido lo ocurrido, para citar un clásico exabrupto de Calderón, así fue la versión oficial difundida por todos lados. Normal, no había manera de que el gobierno federal reconociera una afrenta así y resultaba muy complicado comprobar lo contrario, se hubiera requerido tener contactos muy riesgosos dentro del crimen organizado y que éstos aportaran evidencias rotundas.    Pero hoy, las cosas podrían ser diferentes: la Fiscalía de Estados Unidos posee una oportunidad de oro para hacer pedazos a García Luna y buscar cadena perpetua para su viejo aliado. La fiscal adjunta Saritha Komatireddy, que encabeza el equipo de fiscales en la Corte del Distrito Este de Nueva York en Brooklyn, junto a Erin M. Reid, Philip Pilmar, Marietou E. Diouf y Adam Amir, solo tiene que exhibir una cosa ante el juez Brian M. Cogan: una prueba de ese levantón.      Si El Grande dice la verdad, no puedo creer que Beltrán Leyva no haya guardado una imagen de tal encuentro forzado. Una foto, un video, un audio, algo, a menos de que en aquel violento operativo la Marina haya interceptado, en los teléfonos o computadoras de El Barbas, esas pruebas incriminatorias y que el narco no hubiera tenido la prudencia de mandarle copia a alguien.     En fin, si más allá de los dichos de los miembros del narco no hay evidencias contundentes de parte de la Fiscalía gringa, los dos meses del juicio solo serán un circo, una comedia de muñecos para crucificar a García Luna sin que nadie más sea imputado. Por ejemplo, Felipe Calderón, por complicidad u omisión.     Veremos.                                                                                                                        [email protected]                                                                                                                    Twitter: @jpbecerraacosta   Suscríbete aquí para recibir directo en tu correo nuestras newsletters sobre noticias del día, opinión, y muchas opciones más.",,http://www.eluniversal.com.mx/opinion/juan-pablo-becerra-acosta-m/le-creo-al-narcote-confeso-o-al-presunto-super-cop-narco
"
El precio máximo del gas LP (licuado de petróleo) dará un salto de 38 centavos por kilogramo en las 16 alcaldías de la Ciudad de México, a partir del primer minuto del domingo 29 de enero, lo que representa un incremento de 2% en comparación con el valor que tuvo la semana del 22 al 28 del mismo mes. El precio del combustible que se distribuye en cilindros metálicos será de 19.56 pesos por litro y estará vigente hasta el próximo sábado 4 de febrero, según dio a conocer la Comisión Reguladora de Energía (CRE), a diferencia de los 19 pesos con 18 centavos que los usuarios pagaran hasta el día de hoy.     Con ello, en los primeros 29 días del año los capitalinos han resentido un incremento de 94 centavos por kilogramo en este combustible usados en 7 década 10 hogares del país, un aumento 5% tomando como referencia el precio con el que inició el ejercicio fiscal 2023 -estimado en 18.62 pesos por kilogramo-. Pero eso no es todo para los habitantes de la CDMX, pues todavía hasta hoy hay empresas distribuidoras que mantienen precios muy por encima de los valores máximos fijados por la CRE: Por ejemplo, Grupo Centurión Combustibles vende el mismo kilogramo en 22.34 pesos por kilogramo; Gas Express Nieto lo comercializa en 28.11 pesos; Compañía de Gas del Centro lo vende en 21.65 pesos; y GG Gas lo vende en 23.38 pesos, entre otros.     Estas disparidades han llevado a la Comisión Federal de Competencia Económica (Cofece) a investigar, desde marzo del 2021, “posible manipulación de precios en venta del gas LP”  De hecho, en noviembre del año pasado, el órgano regulador multó con un total de 2 mil 414 millones de pesos a 53 empresas y 34 personas que se coludieron para fijar, elevar, concertar y manipular el precio del distribución del carburante mediante planta de distribución y expendios en estaciones de servicio, así como dividir, distribuir, asignar o imponer porciones del mercado, mediante clientela en el territorio nacional.  ¿Cuánto costará en el Edomex? El aumento del precio que estará vigente a partir del domingo 29 de enero, también impactara al Estado de México, considerado otro de los centros de consumo más importantes de nuestro país.     Municipios como Sultepec y Tenancingo, tendrán a partir de mañana un aumento del precio del gas LP de 19.86 a 20.30 pesos por kilogramo, mientras que en municipios como Atlacomulco o Amanalco pasará de 19.80 a 20.21. Suscríbete aquí para recibir directo en tu correo nuestras newsletters sobre noticias del día, opinión, opciones para el fin de semana, Qatar 2022 y muchas opciones más. mcc",,https://www.eluniversal.com.mx/cartera/gas-lp-precio-subira-hasta-38-centavos-por-kilo-en-la-cdmx-partir-del-domingo
"
El jueves tuve la fortuna de cumplir 63 años. Me gustó. Celebrar plácidamente, más aún. Tuve tiempo para reflexionar como han ido las cosas y la vida pública, desde que tengo memoria.
Nací cuando gobernaba Adolfo López Mateos y pasé parte de mi niñez en el sexenio de Gustavo Díaz Ordaz, a quien inevitable asocio con el movimiento estudiantil, la matanza de Tlatelolco, los Juegos Olímpicos y el Mundial de Futbol. De la trágica Noche de Tlatelolco, recuerdo los gritos de una muy joven vecina del edificio en que vivíamos y a sus padres desesperados por calmarla por los horrores que había presenciado, buscando el auxilio de mi papá, quien era médico.
Mi adolescencia fue durante el gobierno de Luis Echeverría. Recuerdo la matanza estudiantil del jueves de Corpus, que casi nos deja huérfanos porque mis padres fueron de curiosos y les tocó, a distancia, la horrible balacera. Regresaron espantadísimos de ver cómo ambulancias públicas recogían cadáveres en las calles.
Inolvidable el Concierto de Avándaro, del que por supuesto solo me enteré por los diarios y la sorpresa de mi mamá ante los excesos que se narraban de los hippies, (que ahora me hace sonreír). Y no podría dejar de mencionar los interminables informes de gobierno que duraban horas y horas. (Me preguntaba: ¿y si le dan ganas de ir al baño?) 
Luego tuve conciencia de la represión política, del desastre económico y de sus sueños guajiros de ser líder mundial o continental, como YSQ.
En el sexenio de López Portillo, su “Administración de la abundancia” por el boom petrolero, sus excesos personales y familiares y sus citas en los informes como el espejo negro de Tezcatlipoca y su defensa del peso como un perro, la devaluación, la expropiación de la banca y la inolvidable visita de Juan Pablo II. Entré a la Ibero y luego a Televisa.
Con Miguel de la Madrid, la “Renovación Moral de la Sociedad” y el surgimiento de la Sociedad Civil ante la inacción oficial tras los temblores del 85, la inflación superior al 100 ciento y el conflicto postelectoral de 1988.
De Carlos Salinas de Gortari, el TLC, pero también los asesinatos de Luis Donaldo Colosio, de José Francisco Ruiz Massieu y del cardenal Juan Jesús Posadas Ocampo, el surgimiento del EZLN.
De Ernesto Zedillo, el “error de diciembre”, el rescate bancario a través del Fobaproa, la matanza de Acteal, los enfrentamientos con el EZLN, el triunfo de la oposición en el gobierno capitalino y la llegada de la transición.
Con Vicente Fox, ¿algo además de Martita?: el “toallagate”, el “comes y te vas” a Fidel Castro, la fuga de El Chapo, sus locuacidades.
Con Calderón, la extinción de Luz y Fuerza, la guerra contra el narco, el incendio de la Guardería ABC, las muertes violentas de los secretarios de Gobernación Juan Camilo Mouriño y Francisco Blake Mora.
Con Peña, la frivolidad, las dizque Reformas Estructurales, Ayotzinapa, los gasolinazos, la Casa Blanca, la Estafa Maestra, el desprestigio y el atasque corrupto de cercanos y distantes que finalmente permitieron la llegada de quien hoy nos gobierna.
A  Andrés Manuel López Obrador lo conocí hace décadas, cuando era un líder social opositor que parecía con buenas intenciones, seguí su ascenso político y su terquedad electoral. Lo vi con otros ojos cuando ordenó el plantón en Paseo de la Reforma. Finalmente ganó, en 2018, y despertó grandes expectativas. Con sus programas de bienestar, consolidó su clientelismo político entre los más pobres, canceló grandes obras y se empecinó en otras. Hace mutis con la corrupción y el abuso, la terquedad se volvió necedad, asomando el autoritarismo. Hasta ahora. Qué decepción.
Y otra vez me pregunto: ¿neta? ¿con la 4T hasta la muerte? (Pensando que se queden muchos más sexenios). 
 

[email protected]

Suscríbete aquí para recibir directo en tu correo nuestras newsletters sobre noticias del día, opinión, y muchas opciones más.
",63,http://www.eluniversal.com.mx/opinion/amador-narcia/63
"
Los plásticos son un producto humano. Omnipresentes, tardan centenares o miles de años en descomponerse en moléculas que no causan daño. Son substancias y aditivos químicos que nos envuelven, se desmenuzan, viajan por el aire, caen con la lluvia, flotan en océanos, ríos y lagos. Los plásticos colman nuestra vida diaria. Cada día respiramos plásticos, están en nuestros pulmones; los ingerimos con los alimentos y los bebemos con el agua; penetran nuestras células, han sido hallados en la sangre de humanos adultos y en la placenta de bebés que no han nacido. Hay plásticos en todos los continentes–y han descendido 11,000 metros hasta el fondo de la Fosa de las Marianas y escalado 9,000 metros hasta la cima del Monte Everest. Según un análisis reciente de Helene Wiesinger y colegas de la Escuela Politécnica Federal de Zúrich, cada año se producen en el planeta más de 350 millones de toneladas de plásticos. Son materiales sintéticos que utilizamos para muchas cosas –desde empaquetado, construcción, electrónicos, textiles, artículos del hogar, juguetes y muchos otros procesos industriales– y en cuya producción y procesamiento se usan muchas substancias químicas que afectan la salud de consumidores y ecosistemas. Una gran cantidad de plásticos llega al océano. Según Roland Geyer de la Universidad de California, en los últimos 170 años se produjeron 8, 300 millones de toneladas de plástico y la mayoría han terminado en rellenos sanitarios, o contaminando continentes y océanos. La Fundación MacArthur y el World Economic Forum estiman que anualmente llegan a los océanos 8 millones de toneladas de plásticos y hay ya acumuladas 150 millones de toneladas. En los océanos, la mayoría de los plásticos se descompone en partículas de menos de cinco milímetros, los microplásticos, que resultan del desarrollo específico de productos comerciales –como cosméticos, ropa, textiles– y de la descomposición de plásticos más grandes–como bolsas y botellas de plástico. Se han encontrado en el diminuto plancton y en el estómago de aves, mamíferos y reptiles marinos. El Convenio sobre la Diversidad Biológica reveló que las siete especies de tortugas marinas, casi la mitad de las especies de mamíferos marinos y la quinta parte de las especies de aves marinas estudiadas son afectadas por ingerir, o enredarse en plásticos. Discutimos, sin ponernos de acuerdo, sobre si los microplásticos son tóxicos para los humanos y sobre cuáles son exactamente sus efectos nocivos–cardiovasculares, respiratorios, gastrointestinales, inmunológicos, neurológicos, genéticos. El estudio de la Dra. Wiesinger concluyó que más de 2, 400 substancias utilizadas en los plásticos son de preocupación potencial por su persistencia (mantenerse constantes por largo tiempo), bioacumulación (acumulación de substancias químicas en organismos vivos) y toxicidad (capacidad de un químico de perjudicar un ser vivo, al entrar en contacto con él). Y más de la mitad de esas substancias no están reguladas adecuadamente en muchas partes del mundo y 901 están aprobadas para usarse en plásticos en contacto con alimentos. Su conclusión más importante es que, dada la multitud y diversidad de químicos que se adicionan a los plásticos y los riesgos para la salud, debemos transitar a la “economía circular” sustentable del plástico–es decir, dejar de concebirlo como “basura” y verlo como un recurso renovable que debe ser reutilizado sin que contamine el medio ambiente. Suena bien…pero ¿no será que, ante todo, deberíamos reflexionar sobre nuestros patrones de consumo y la cantidad de plástico que utilizamos e inunda nuestra vida diaria? ¿No será que la respuesta está en las cuatro erres por las que abogan las Naciones Unidas–reducir, reutilizar, reciclar, recuperar? Ustedes, lectores, tienen la última palabra.  Suscríbete aquí para recibir directo en tu correo nuestras newsletters sobre noticias del día, opinión, y muchas opciones más.",,http://www.eluniversal.com.mx/opinion/omar-vidal/microplasticos
