body,title,url
"
El juicio a Genaro García Luna, en la Corte Federal del Este de Brooklyn, en Nueva York, en un buen ejemplo de que, para la Justicia de los Estados Unidos no hay temporalidad ni prescripción cuando se trata de castigar delitos y conductas que, de acuerdo a sus leyes extraterritoriales, afectaron su legalidad e intereses. Diez años después de que el expoderoso exsecretario de la Seguridad Pública mexicana terminara su cargo en el sexenio calderonista, y aun habiendo sido reconocido y homenajeado por agencias del gobierno estadounidense como “policía ejemplar” y “amigo” de los americanos, García Luna está hoy sentado en el banquillo de los acusados por delitos de narcotráfico y en un juicio que le augura una larga condena en una prisión de máxima seguridad de la Unión Americana. La reflexión viene a cuento porque, justo los que hoy están tan entusiasmados y exaltados por el juicio al exfuncionario calderonista, tanto que celebran la realización del mismo como “un acontecimiento muy importante” y difunden y replican todo lo que se dice en las audiencias de la Corte del Distrito Este, como un tema “que todos los mexicanos deben saber y estar informados”, podrían sufrir una vuelta del revés y estar dentro de algunos años, en un futuro no muy lejano, también siendo acusados, investigados y quizás hasta juzgados por un tribunal estadounidense por posibles delitos contra las leyes norteamericanas. Y es que así como a Genaro García Luna tardaron años para armarle un expediente judicial con denuncias y testimonios que provenían desde el periodo de 2006 a 2012, cuando el entonces secretario y principal estratega del presidente Felipe Calderón en su “guerra contra el narco” estaba en los cuernos del poder, y no fue sino hasta 7 años después de terminado aquel sexenio cuando lo detuvieron en diciembre de 2019 en la ciudad de Dallas, Texas, igual ahora mismo podrían estarse fraguando y llenando “expedientes criminales” en varias agencias del gobierno de Estados Unidos, en contra de personajes de poder en el actual gobierno de Andrés Manuel López Obrador. Imaginemos, por un momento y en un ejercicio de ficción, que ya es el año 2033 y en esa misma Corte Federal de Brooklyn, empieza un juicio contra un general retirado del Ejército Mexicano, tres exgobernadores y un ex dirigente del partido gobernante en México. A todos ellos los acusan de haber tenido relación con el asesinato de un empresario de México que, a través de contrabando ilegal (huachicoleo) de gasolinas y diésel estadounidense por las aduanas mexicanas, obtuvo ganancias multimillonarias en dólares con las que apoyó campañas políticas de candidatos del partido oficial más de 12 años antes, en el año 2021. El juicio sería, sin duda todo un escándalo, y así como ahora los actuales gobernantes disfrutan y se solazan hablando de ese juicio y de los siniestros personajes que desfilan en él, habría seguramente otros en el poder que se divirtieran e hicieran de ese enjuiciamiento a políticos mexicanos “un asunto de la mayor importancia para todos los mexicanos”. Eso, que por ahora es solo ficción, podría tener algún viso de realidad si se toma en cuenta que el expediente que abrieron al menos una agencia del gobierno estadunidense, la DEA, está vigente sobre las actividades ilícitas que llevaba a cabo el empresario tamaulipeco Sergio Carmona, quien fue asesinado en noviembre de 2021 en San Pedro Garza, Nuevo León, en condiciones y por motivos aún no esclarecidos. Antes de que lo mataran, Carmona se había reunido con agentes del FBI y del DEA, por separado, en al menos dos ocasiones. Los encuentros tuvieron lugar en la ciudad de Monterrey y en ellos Sergio habló del negocio millonario de huachicol de combustibles que él manejaba por la Aduana de Reynosa, con el conocimiento y protección de un alto mando de la seguridad y la inteligencia federal mexicana. De acuerdo con fuentes que conocieron de esos encuentros, al menos una de las declaraciones a la DEA tuvo carácter y Sergio Carmona estaba en vías de negociar una figura de “testigo protegido” o “testigo de interés” para la justicia de los Estados Unidos, a partir de la información que había ofrecido a los agentes estadounidenses sobre un presunto financiamiento millonario que él entregó a la dirigencia nacional de Morena y a las campañas de al menos tres candidatos a gobernador por ese partido en 2021. Ese documento, en manos de la justicia estadounidense, sería la base de un expediente que está abierto y que podría dar los elementos legales suficientes para que el Departamento de Justicia de Estados Unidos iniciara en un futuro, primero una investigación y después un juicio, sobre la muerte y el asesinato de Sergio Carmona Angulo, quien a partir de que declaró ante una autoridad del país vecino, podría ser considerado un “testigo clave” para la investigación de delitos y violaciones contra las leyes estadounidenses. Se podría invocar, en ese caso, un juicio “post mortem” de un “testigo de interés” para los Estados Unidos, y en ese proceso podría involucrarse a los políticos y funcionarios de Morena y de la 4T que el mismo Carmona mencionó en sus declaraciones, como parte de su red de sobornos y financiamientos políticos con dinero ilegal. Y seguro dirán que eso son meras especulaciones y que lo que hoy se ve como mera ficción es imposible. Pero así empezaron las investigaciones contra Genaro García Luna, quien ya durante el auge de su inmenso poder, durante los años del calderonismo, había recibido acusaciones, señalamientos y hasta declaraciones de narcotraficantes como testigos protegidos que lo vinculaban al Cártel de Sinaloa y a los sobornos que presuntamente recibía para dar protección a esa organización. El propio García Luna, si le hubieran dicho en 2013 que iba a terminar siendo detenido y acusado por la justicia de Estados Unidos de cargos por narcotráfico, se hubiera reído, porque se sentía tan impune que hasta compró casas, mansiones y creó sociedades, fideicomisos y empresas en el sistema financiero estadounidense. 6 años después lo apresaron y tres años después, en este 2023, está en el banquillo de los acusados. Por eso quizás no debieran festejar tanto en la 4T ni promocionar como lo hacen, como una suerte de divertimento o distractor político, el juicio que hoy enfrenta en exsecretario calderonista de seguridad. Ya decía el maquiavélico obispo de París, Charles Maurice de Talleyrand, que incitó a revoluciones, engañó a reyes y encumbró y traicionó a muchos políticos de su época: “los carniceros de hoy serán las reses del mañana”. Y tal vez lo que hoy parece ficción, para el 2033 no sea tan irreal y veamos en la Corte Federal de Brooklyn nuevos juicios, nuevos acusados y antiguos carniceros convertidos en reses y en el banquillo de los acusados. Después de todo entre la realidad y la ficción siempre termina imponiéndose la realidad. NOTAS INDISCRETAS… Desde adentro de su propio equipo salen comentarios y quejas de que la Jefa de Gobierno ha elevado el nivel de tensión y los gritos a sus colaboradores, derivado de la crisis del Metro que no terminan de resolver. Aunque sus cercanos están acostumbrados a los modos secos y recios de la doctora Sheinbaum, en los últimos días la han visto mucho más tensa e irritable por la presión que ha significado la problemática del Metro. Y es que las caídas de entre 2 y 5 puntos de su aceptación que empiezan a registrar las primeras encuestas tienen muy nerviosos a los asesores de la Jefa que, con todo y el respaldo presidencial y la presencia multitudinaria de los militares de la Guardia Nacional en el Metro, aún no logra probar del todo y de manera contundente su teoría del sabotaje como fuente de los constantes accidentes, incendios y situaciones de riesgo para los pasajeros y usuarios que se están registrando en las instalaciones de ese medio de transporte. Y para colmo, mientras Sheinbaum sigue en apuros y tuvo que suspender sus giras de promoción por la República, a Marcelo Ebrard se le acomodaron las cosas a partir de la crisis de la CDMX, pero también de los resultados de la Cumbre de Líderes de Norteamérica. Incluso con el libro de Mike Pompeo, “Never give an Inch”, que empezó a circular esta semana, el canciller si bien es señalado por el exsecretario de Estado de haberle pedido “no revelar los acuerdos” migratorios y políticos que hizo Marcelo con el propio Pompeo, también en el texto hay varias expresiones elogiosas para el canciller mexicano que es calificado por el exsecretario trumpista como un negociador confiable. Así que, entre el mal humor de unas, el impulso de otros y la campaña que no cesa de Adán Augusto López, está claro que las corcholatas se siguen moviendo, pero podríamos estar ante un punto de quiebre en la adelantada sucesión presidencial en donde, por primera vez, la favorita ya no se ve tan fuerte y los dos “plan B”, Marcelo y Adán, podrían tomar en cualquier momento ventaja de la crisis y los apuros de Claudia…Los dados mandan Doble Escalera. La semana cierra bien.  Suscríbete aquí para recibir directo en tu correo nuestras newsletters sobre noticias del día, opinión, y muchas opciones más.",,http://www.eluniversal.com.mx/opinion/salvador-garcia-soto/brooklyn-2033-o-cuando-el-futuro-los-alcance
"
Ya en otras ocasiones te hemos compartido cuáles son los beneficios del jengibre, el tallo subterráneo o rizoma de la planta que es originario de los bosques lluviosos tropicales del sur del continente asiático. Por lo general lo encuentras fresco, seco, en polvo o como aceite, lo que quizá no sabías es que se puede preparar agua con él para gozar de sus propiedades.  Lo primero que vale la pena aclarar es que si tienes planeado incorporar algún remedio a tu dieta lo mejor es que primero consultes con un profesional de la salud, en especial si tienes algún padecimiento.      Y es que, en el caso del jengibre por ejemplo, si bien tiene muchas propiedades positivas, también hay contraindicaciones, en especial si se consume con frecuencia.  Imagen: Unsplash Leer también: Así protege tu cerebro el jengibre      ¿Cuáles son los beneficios del agua de jengibre? La planta de jengibre es rica en sustancias químicas naturales que pueden promover tu salud, tal como señala Healthline.  Y aunque por lo general se utiliza como una especia para dar sabor a los platillos, también hay otras maneras de consumirlo, entre ellas, agua o té de jengibre, preparación que permite gozar de todas sus propiedades.  Hay que aclarar que aún hace falta investigación al respecto. No obstante, hasta ahora, de acuerdo con Healthline, el agua de jengibre ha resultado eficaz en los siguientes casos:      Antiinflamatorio. Un estudio encontró que el jengibre puede reducir las reacciones alérgicas, en las que la inflamación puede desempeñar un papel. Otra investigación concluyó que las personas que tomaban suplementos diarios de jengibre tenían menos dolor muscular después de hacer ejercicio, recordemos que el dolor muscular se puede deber a una inflamación. Antioxidante. Las propiedades antioxidantes del jengibre pueden ayudar a prevenir diversos padecimientos, desde los cardíacos y ciertos tipos de cáncer, hasta enfermedades neurodegenerativas, como Parkinson y Alzheimer.  Imagen: Unsplash Cuida tus riñones. Un estudio encontró que el jengibre puede ayudar a prevenir o retrasar la insuficiencia renal, además de retardar el crecimiento de tumores.     Antinauseoso y digestivo. El jengibre es bien conocido por ayudar a aliviar la indigestión, los vómitos y las náuseas.  Equilibrar el azúcar en sangre. Un estudio encontró que, en las personas con diabetes, el jengibre mejoraba el azúcar en sangre en ayunas.  Colesterol. Una investigación mostró que el jengibre redujo los marcadores de enfermedades cardíacas como la actividad de la arginasa, el colesterol LDL (malo) y los triglicéridos en ratas con una dieta alta en grasas. Pérdida de peso. En combinación con una dieta saludable y ejercicio, el agua de jengibre puede ayudar a promover la pérdida de peso pues brinda una sensación de saciedad por más tiempo. Leer también: ¿Cómo hacer galletas de jengibre?  ¿Cómo se prepara el agua de jengibre? Gozar de todos los beneficios anteriores es más simple de lo que crees solo necesitas la raíz de jengibre y agua.  Toma en cuenta que los mejores resultados los obtendrás con jengibre fresco y no usando suplementos o sustitutos con sabor artificial.  Para preparar agua de jengibre primero lava la parte de la raíz que vas a usar. Después usa un rallador para obtener 1/2 cucharadita de jengibre, puedes hacerlo con la cáscara. A continuación, hierve 4 tazas de agua y agrega el jengibre una vez que esté hirviendo. Deja al fuego por unos minutos, retira y deja reposar la mezcla durante 10 minutos. Cuela los trozos y listo, puedes beber el agua caliente o fría. Si su sabor te parece muy intenso puedes endulzar con una cucharadita de miel. Respecto a la frecuencia de consumo, los médicos recomiendan consumir un máximo de 4 gramos de extracto de jengibre (2 cucharaditas) por día y considera que no se aconseja darlo a menores de 2 años. Imagen: Unsplash Leer también: Beneficios de la infusión de jengibre con limón  Riesgos de tomar agua de jengibre  La primera advertencia es que el jengibre puede interactuar mal con ciertos medicamentos, por lo que lo mejor es consultar con un médico, en especial las personas con afecciones cardíacas, diabetes y cálculos biliares.  Por otro lado, si tomas agua de jengibre con mucha frecuencia podrías experimentar acidez estomacal, gases, dolor de estómago y ardor en la boca.  Leer también: Vino y ajo, la combinación que previene múltiples enfermedades Recibe todos los viernes Hello Weekend, nuestro newsletter con lo último en gastronomía, viajes, tecnología, autos, moda y belleza. Suscríbete aquí: https://www.eluniversal.com.mx/newsletters       7 taquerías para comer tacos de tripa        ",,https://www.eluniversal.com.mx/menu/que-pasa-si-tomas-agua-de-jengibre-frecuentemente
"
El margen de error para el América ha desaparecido. De no ganar esta noche en el Estadio Azteca contra el Mazatlán, se encenderán las alarmas en el Nido de Coapa. Después de tres empates consecutivos (dos en el Coloso de Santa Úrsula), la presión ha aumentado para los de Fernando Ortiz en este arranque del torneo Clausura 2023.           Purdy y Hurts, a saldar cuentas pendientes          Además, en el cuadro azulcrema hay una obligación extra: Colgar el cero en su casa. Los emplumados, en tres duelos disputados, suman cuatro goles en contra y en la semana hicieron énfasis en el trabajo defensivo. Leer también: Chivas se presenta como favorito en su visita a los Bravos de Juárez “Se han integrado en la semana este tipo de trabajos para estar más fortalecidos en esa zona. Obviamente lo hemos entrenado y estamos más fuertes para enfrentarlo este fin de semana. Nos juntamos entre compañeros a hablar este tipo de cosas, porque es algo en lo que tenemos que estar fortalecidos, debemos mantener el cero atrás”, declaró el zaguero mexicano Israel Reyes.     Este inicio aún está lejos de ser el peor para el cuadro capitalino; sin embargo, una victoria es la única opción que tienen para esta noche frente a los Cañoneros, que se encuentran en el fondo de la clasificación, con dos derrotas y un partido pendiente (contra León). Asimismo, el futbolista de las Águilas pidió calma a la afición y confía en que los buenos resultados llegarán próximamente.    Purdy y Hurts, a saldar cuentas pendientes             “Hay que estar tranquilos, el equipo trabajó de buena forma esta semana y confiamos en que este fin de semana mantendremos el cero en nuestra portería”, agregó. Las Águilas llegan a este choque con cuadro casi completo, ya con el regreso del atacante Alejandro Zendejas, quien disputó un encuentro amistoso con la selección de Estados Unidos, frente a su similar de Serbia; la única ausencia seguirá siendo la de Federico Viñas, luego de una lesión que sufrió en la pantorrilla, en un entrenamiento de la semana anterior. TE PODRÍA INTERESAR: VIDEO: Conor McGregor fue atropellado y casi pierde la vida  Suscríbete aquí para recibir directo en tu correo nuestras newsletters sobre noticias del día, opinión, Qatar 2022 y muchas opciones más.    ",,http://www.eluniversal.com.mx/universal-deportes/para-america-es-forzoso-ganar-contra-un-debil-rival
"
 Escuelas primarias de los turnos matutino y vespertino de la zona metropolitana tendrán una campaña especial de vacunación contra Covid-19 para menores de 5 a 11 años que no han recibido la primera o segunda dosis del biológico Pfizer pediátrico, informó el titular de la Secretaría de Educación de Gobierno del Estado (SEGE), Juan Carlos Torres Cedillo.  El funcionario estatal detalló que en las jornadas se contará con el poyo de la Brigada Correcaminos y el Instituto Mexicano del Seguro Social (IMSS), así como supervisores y directivos de los centros educativos públicos y privados.  La finalidad de la campaña es reforzar las labores de cuidado y protección de las y los niños potosinos contra el Covid-19.   Casos de Covid-19 e infecciones respiratorias disminuyen en SLP         Horarios de vacunación Covid en escuelas  El calendario de las fechas y horarios de brigadas en cada centro educativo quedan de la siguiente manera: turno matutino habrá un horario de 10:00 a 13:00 horas, turno vespertino de 14:00 a 17:00 horas. Cada director dará a conocer la información a las y los docentes, así como a la comunidad educativa.  Madres, padres de familia o tutores deberán presentar el día de la vacuna la carta de consentimiento firmada y llenada con los datos que se indican, especificando si es la primera o segunda dosis, en caso de que ya se les haya aplicado la primera dosis deberán presentar el comprobante para que se aplique la segunda.     Anuncian nueva jornada de vacunación contra Covid-19 para mayores de 18 años en SLP          El personal de la Brigada Correcaminos se presentará en el centro escolar con uniforme y gafete que la identifique como representante de dicha institución de salud.}  Vacunas para todos  En caso de que algún menor de edad acompañado de un adulto no esté inscrito en la escuela sede, pero pida la aplicación de la vacuna, no se le negará el biológico; se le dará acceso siempre y cuando cubra el requisito de carta de consentimiento, informaron las autoridades.    



",,https://sanluis.eluniversal.com.mx/sociedad/anuncian-jornada-de-vacunacion-contra-covid-19-en-escuelas-de-san-luis-potosi
"

La UNAM ha sido mi segunda casa: refugio, lugar de crecimiento, de socialización, de esparcimiento, de conocimientos, de vida. Una larga vida: la de ella y la mía en su campus.

En un ya lejano septiembre del 76, recibí la notificación de que había sido admitida a la Facultad de Derecho. Mi hermana, dos años mayor, ya estaba en la Facultad de Arquitectura y me había enseñado cómo llegar a la Magdalena Mixhuca donde se celebró el examen de admisión. Me fui uniendo en el camino a los cientos de esperanzados estudiantes que llevaban en la mano el inconfundible lápiz amarillo para marcar los reactivos.

Dejé en Chiapas mis lagos, ríos, montañas y familia para esta aventura que aún no termina. De Copilco, solo cruzaba para estar en Ciudad Universitaria. Ese espacio en el que tantas veces he visto salir el sol por Medicina y ocultarse por el Estadio Olímpico.

Empecé a hacer amigos, a conocer a los maestros que escribían libros, a ir a la Torre II de Humanidades, donde estaba un incipiente Instituto de Investigaciones Jurídicas con becarios que hasta hoy son mis amigos. En el elevador de ese edificio conocí a Don Rubén Bonifaz Nuño quien me pidió le dijera tío sin hurgar más en la genealogía.

Aproveché la música en la Neza, las muestras de cine en el Bracho y el Revueltas, los domingos de danza en el taller coreográfico, a veces teatro y mucha, mucha cultura. La UNAM me entregó todo a manos llenas.

Tuve amigos de todas las clases sociales. Era amiga del hijo del chofer de un camión repartidor de Jarritos y también del hijo de nuestro Embajador en Austria. Había compañeros que planeaban veranos en Europa y otros que, como yo, esperábamos las vacaciones para retornar a los sabores de la comida materna en Sinaloa, Tabasco, Veracruz o Baja California.

Hice mi servicio social en el Seminario de Sociología. Muy pronto me titulé y decidí ser maestra de Introducción al Estudio del Derecho. Así comencé a recibir a estudiantes, poco menores que yo, que reforzaban en la clase su vocación y un interés real por la carrera. Después empecé a impartir Filosofía del Derecho en el décimo semestre. Así, año tras año, recibía caras nuevas, encauzaba inquietudes, respondía dudas, acrecentaba otras, acompañaba la construcción de sueños —que los hacía propios—, destruía mitos, inyectaba confianza, contagiaba entusiasmo y daba esperanza a granel porque los preparaba en el pensamiento crítico.

Siempre alerté a mis alumnos de lo que les esperaba afuera. Les insistía en que mantuvieran sus ideales siempre tocando tierra. Les decía que la justicia era algo de lo que se debía hablar, más que en Derecho en la vecina Facultad de Economía.

La UNAM siempre ha sido un espacio cómodo, al que sin duda pertenezco. Me alegran sus logros, los reconocimientos internacionales que recibe, los descubrimientos que se hacen en cada uno de sus múltiples laboratorios. Sus aportes a la sociedad mexicana y al mundo. Me siento hermanada con tantas personas que encontraron ahí su ámbito vital.

La UNAM es una Universidad enorme (hoy tiene más de 370 mil estudiantes y más de 42 mil académicos). En ejercicio de la autonomía personal y con infinidad de alternativas puestas, cada quién traza en ella, con ella y para ella, el futuro que desea. El prestigio de una Universidad de masas solo se construye a partir de responsabilidades individuales. ¡Orgullo UNAM!
 

Catedrática de la UNAM @leticia_bonifaz
 

 
Suscríbete aquí para recibir directo en tu correo nuestras newsletters sobre noticias del día, opinión, y muchas opciones más.

 
",Orgullo UNAM,http://www.eluniversal.com.mx/opinion/leticia-bonifaz-alfonzo/orgullo-unam
"
El director general del Consejo Empresarial Mexicano de Comercio Exterior (COMCE), Fernando Ruiz Huarte, falleció este sábado por la mañana, dio a conocer el Consejo Coordinador Empresarial (CCE).    El #CCE lamenta el sensible fallecimiento de nuestro querido amigo Fernando Ruiz Huarte, Director General del @ComceOficial y gran promotor del Comercio Exterior. Nuestro más sentido pésame a su familia y amigos. Descanse en paz. pic.twitter.com/RgNKSqkzij      — Consejo Coordinador Empresarial CCE (@cceoficialmx) January 28, 2023  En dicho cargo, Ruiz Huarte dio seguimiento de las negociaciones para modernizar el Tratado de Libre Comercio de América del Norte (TLCAN) ahora Tratado entre México, Estados Unidos y Canadá (T-MEC). También, como representante del sector privado, participó en la modernización del Tratado Unión Europea-México y en la negociación del Tratado Integral y Progresista de Asociación Transpacífico, entre otros.      En su cuenta de Twitter, el COMCE lamentó el fallecimiento de Ruiz Huarte, quien también fue vicepresidente de Relaciones Gubernamentales del organismo, y destacó que su contribución al desarrollo del Comercio Exterior en México.    pic.twitter.com/UZgT2IoBdd  — COMCE (@ComceOficial) January 28, 2023      Lee también Por fin, AIFA entra al top 10 de tráfico de pasajeros nacionales Suscríbete aquí para recibir directo en tu correo nuestras newsletters sobre noticias del día, opinión, opciones para el fin de semana, Qatar 2022 y muchas opciones más. mcc",,https://www.eluniversal.com.mx/cartera/fallece-director-del-comce-fernando-ruiz
